{
  "schema_version": "0.1.0-draft",
  "schema_status": "DRAFT",
  "is_synthetic": true,
  "session_id": "synthetic-session-001",
  "source_id": "synthetic-browser-001",
  "timestamp": "2026-01-01T00:00:13.000Z",
  "source": "browser",
  "event_id": "synthetic-event-002",
  "event_type": "TAB_HIDDEN",
  "started_at": "2026-01-01T00:00:10.000Z",
  "ended_at": "2026-01-01T00:00:12.000Z",
  "start_offset_ms": 10000,
  "end_offset_ms": 12000,
  "duration_ms": 2000,
  "severity": null,
  "evidence": null
}
