{
  "schema_version": "0.1.0-draft",
  "schema_status": "DRAFT",
  "is_synthetic": true,
  "session_id": "synthetic-session-001",
  "source_id": "synthetic-camera-001",
  "timestamp": "2026-01-01T00:00:13.000Z",
  "source": "webcam",
  "event_id": "synthetic-event-001",
  "event_type": "HEAD_TURNED",
  "started_at": "2026-01-01T00:00:10.000Z",
  "ended_at": "2026-01-01T00:00:12.000Z",
  "start_offset_ms": 10000,
  "end_offset_ms": 12000,
  "duration_ms": 2000,
  "severity": null,
  "evidence": {
    "first_sequence": 100,
    "last_sequence": 120
  }
}
